{
  "$schema": "https://json-schema.org/draft/2020-12/schema",
  "type": "object",
  "required": ["task_id", "repo", "captured_at", "rulesets", "attestations"],
  "properties": {
    "task_id": {"type": "string"},
    "repo": {"type": "string"},
    "captured_at": {"type": "string"},
    "rulesets": {"type": "object"},
    "attestations": {"type": "array"},
    "repo_visibility": {"type": "string"},
    "repo_owner_type": {"type": "string"},
    "workflow_checks": {"type": "object"}
  },
  "additionalProperties": false
}
