{
  "task_id": "tvs-20260129-001",
  "repo": "Spartoi-development-team/spartoi-project",
  "captured_at": "2026-01-29T15:30:00Z",
  "rulesets": {
    "repo_rulesets": [
      {
        "id": 12207798,
        "name": "main",
        "target": "branch",
        "source_type": "Repository",
        "source": "Spartoi-development-team/spartoi-project",
        "enforcement": "active"
      },
      {
        "id": 12219645,
        "name": "main-protection",
        "target": "branch",
        "source_type": "Repository",
        "source": "Spartoi-development-team/spartoi-project",
        "enforcement": "active"
      }
    ]
  },
  "attestations": [
    {
      "id": "B6_approve_and_run",
      "screenshot": "attestation_actions.png",
      "sha256": "ee0e38801644d0497b3d6fd31e9606da6cc69db0b5fa41508efe3449fc206ce0",
      "setting": "Require approval for first-time contributors",
      "attested_at": "2026-01-29T15:50:00Z",
      "status": "PASS"
    },
    {
      "id": "B7_token_permissions",
      "screenshot": "attestation_actions.png",
      "sha256": "ee0e38801644d0497b3d6fd31e9606da6cc69db0b5fa41508efe3449fc206ce0",
      "setting": "Read repository contents and packages permissions",
      "attested_at": "2026-01-29T15:50:00Z",
      "status": "PASS"
    },
    {
      "id": "B8_required_check",
      "screenshot": "attestation_ruleset.png",
      "sha256": "c3897fee2e2a40f4358b5c603173ee6ecf53e23a67fcdea76beef45fae509672",
      "setting": "docops-gatekit/finalize in required status checks",
      "attested_at": "2026-01-29T15:50:00Z",
      "status": "PASS"
    }
  ],
  "repo_visibility": "public",
  "repo_owner_type": "Organization",
  "workflow_checks": {
    "merge_group_trigger": true,
    "workflow_file": ".github/workflows/docops-gatekit.yml"
  }
}
